{
  "schema_version": "specialist-request/v1",
  "task_id": "channel-run-v1-in_app_popup",
  "campaign_id": "camp_tix_launch_001",
  "product_id": "tixmancer",
  "source_revision": "27826b0332fd1582108ac0081165a7dd360e7aa6",
  "deliverable": "in_app_popup",
  "stage": "draft",
  "voice_profile": "vista-popup-adapted-for-tix-v1",
  "sources": [
    {
      "id": "src-readme",
      "path": "00_baseline/sources/repository/readme.txt",
      "sha256": "dba3d7034dcbd12b838ab56341f8630f155d5d956270a55781df4f44846af854",
      "product_id": "tixmancer",
      "kind": "fact"
    },
    {
      "id": "src-product",
      "path": "00_baseline/sources/repository/product.txt",
      "sha256": "7d42451581387d8cce25e9bd9c03f5671053cf93724b2bcae503758b37f7b708",
      "product_id": "tixmancer",
      "kind": "fact"
    },
    {
      "id": "src-system",
      "path": "00_baseline/sources/repository/how-it-works.txt",
      "sha256": "c285838e5c092d338d119753084b1d7a0b856e482c1a1aa23339a4848519a7b2",
      "product_id": "tixmancer",
      "kind": "fact"
    },
    {
      "id": "voice-vista-popup-adapted",
      "path": "01_channel_run/voice/popup.md",
      "sha256": "6c5dd8238d70f90f090c41657639402ad8711553be34b419b68f0806c8854705",
      "product_id": "tixmancer",
      "kind": "voice"
    }
  ],
  "claims": [
    {
      "id": "TIX-C01",
      "source_id": "src-readme",
      "quote": "Tixmancer is a conversational web app for people who hunt for secondhand finds.",
      "start": 58,
      "end": 137
    },
    {
      "id": "TIX-C02",
      "source_id": "src-product",
      "quote": "Tix helps secondhand buyers and sellers make the next decision. A buyer can\ndescribe an item, location and limit. A seller can bring a listing and ask for\nhelp with the offer. The product starts as a conversation so the user does not\nhave to learn a parser or fill a dashboard before Tix understands the job.",
      "start": 65,
      "end": 373
    },
    {
      "id": "TIX-C03",
      "source_id": "src-product",
      "quote": "The price comparison is deterministic. Tix compares the asking price in a\nrecord with the user’s limit. Market value remains unknown until the product\nhas a supported evidence source.",
      "start": 900,
      "end": 1083
    },
    {
      "id": "TIX-C04",
      "source_id": "src-product",
      "quote": "The preview starts with a clean account. Google sign-in establishes identity.\nThe account owns its conversations, saved facts and preview records. Vercel AI\nGateway supplies the language model.",
      "start": 395,
      "end": 588
    },
    {
      "id": "TIX-C05",
      "source_id": "src-product",
      "quote": "Marketplace search, listing retrieval, connector delivery, wallet funding and\ncheckout are simulated services. They produce stored records from the user’s\nown item and location. The interface labels those records as simulated. It does\nnot present synthetic listings or wallet actions as live external events.",
      "start": 590,
      "end": 898
    },
    {
      "id": "TIX-C06",
      "source_id": "src-readme",
      "quote": "The next product slices are account-owned active hunts, listing photo and file\nattachments, live supported marketplace sources, user-selected notification\nconnectors, and an optional permissioned wallet for one supported seller. The\nwallet flow will expose quoted, awaiting approval, confirming, settled and\nfailed states only after each state is enforced by the payment system.",
      "start": 4783,
      "end": 5161
    },
    {
      "id": "TIX-C07",
      "source_id": "src-product",
      "quote": "A consumer wallet is optional. The planned flow gives the user\na scoped spending permission with an amount cap, expiry, approval and\nrevocation. Deposits and purchases stay outside the consumer preview until a\nsupported seller and the full permission-to-receipt path are verified.",
      "start": 1729,
      "end": 2009
    },
    {
      "id": "TIX-C08",
      "source_id": "src-readme",
      "quote": "[tixmancer.xyz](https://tixmancer.xyz) is the canonical product domain. The\nserver can run it as a restricted preview or as a public waitlist.",
      "start": 269,
      "end": 411
    }
  ],
  "voice_source_ids": [
    "voice-vista-popup-adapted"
  ],
  "artifacts": [],
  "requested_reviewer": "gabe"
}
